{
  "schema_version": "goal_contract_v1",
  "goal_id": "SP-003",
  "revision": "2",
  "mission": "在不建立双向真源的前提下，把私有 sge-governance-skill 设计并演进为唯一 canonical development source，把公开 bm-sge-governance 设计为 exact-allowlist、可重算、可审计的 deterministic public projection/distribution repo，并为维护者与终端用户提供分离且可验证的工作路径。",
  "must_have_ledger": [
    {"requirement_id":"ODA-MH-01","requirement":"冻结私有 canonical source、公开 projection 与禁止双向真源的 source-of-truth contract。","evidence":"双仓 KB contract、Loop Goal、Scope/Authority coverage matrix","status":"pending"},
    {"requirement_id":"ODA-MH-02","requirement":"冻结 bm-sge-governance 的 exact-allowlist public content boundary 与 default-deny/private residue 排除面。","evidence":"public boundary contract、allowlist/d deny cases、clean-room export evidence","status":"pending"},
    {"requirement_id":"ODA-MH-03","requirement":"定义 deterministic export→diff→validation→public repo update 流程及每一步的 authority、输入输出和禁止折叠。","evidence":"maintainer workflow、ERBE cases、independent validation 与 final diff","status":"pending"},
    {"requirement_id":"ODA-MH-04","requirement":"定义 source revision、manifest revision、candidate identity、projection commit、tag/release identity 的互不替代关系。","evidence":"identity contract、candidate/release matrix、可重算 manifest","status":"pending"},
    {"requirement_id":"ODA-MH-05","requirement":"定义公开仓 clone 后的 end-user install 路径：默认 source=current public repo，只需 target，--source 仅作高级/测试入口。","evidence":"Beginner/Quick Start、install contract、clean-room replay","status":"pending"},
    {"requirement_id":"ODA-MH-06","requirement":"定义 upgrade、backup、install record、恢复/卸载的 provenance 与 target authority 保留规则。","evidence":"lifecycle contract、install record schema、backup/rollback evidence","status":"pending"},
    {"requirement_id":"ODA-MH-07","requirement":"物理和合同上分离 maintainer surface 与 end-user surface，禁止用户承担 export/allowlist/release 内部知识。","evidence":"surface matrix、CLI/docs behavior、UAT negative cases","status":"pending"},
    {"requirement_id":"ODA-MH-08","requirement":"定义 public repo 外部 PR 的 review、回流 canonical、重新 export/validation 的单向贡献路径。","evidence":"contribution policy、PR provenance record、clean-room replay","status":"pending"},
    {"requirement_id":"ODA-MH-09","requirement":"冻结 GitHub push/tag/release 权限边界、CI 默认不自动发布与逐次人类授权要求。","evidence":"release governance contract、permission matrix、authorization record template","status":"pending"},
    {"requirement_id":"ODA-MH-10","requirement":"以 clean-room、维护者回归、终端用户 UAT 和 independent validation 验证双仓架构的关键路径与负例。","evidence":"ERBE contract/cases、UAT、Validation Handoff、independent review","status":"pending"},
    {"requirement_id":"ODA-MH-11","requirement":"保持 candidate、validated、approved、published、production-ready、Git mutation 等状态轴分离。","evidence":"state-axis matrix、OPCM、Semantic Review、post-closeout reconciliation","status":"pending"},
    {"requirement_id":"ODA-MH-12","requirement":"完成逐项 Original Plan Coverage Matrix、Scope Delta、中文 closeout、final validation 与 post-closeout reconciliation。","evidence":"SP-003 OPCM、中文 closeout、独立最终对账与 Dashboard 状态","status":"pending"}
  ],
  "sections": {
    "read_manifest": ["AGENTS.md","SP-002 Loop Goal/Goal Patch/Stage Plan/OPCM/Validation/Release Decision Packet","Dashboard current surfaces","existing public_export_manifest_v1.json and tools/sge_public.py","goal_contract_v1 and goal_patch_v1 schemas"],
    "boundary": {"private_source":"sge-governance-skill is the only development source","public_projection":"bm-sge-governance is a one-way projection/distribution repository","direction":"private canonical source -> clean staging -> deterministic public projection","external_side_effects":"GitHub create/push/tag/release remain separately authorized and are outside this design landing"},
    "public_surface": {"allow":"allowlisted generic Skill, public docs/KB/examples/tests/tools and public metadata only","deny":"Dashboard, Sessions, Stage Plans, Agent Logs, closeouts, private provenance, local reports, dirty worktree, absolute paths, credentials and unknown files","overlay":"target-project AGENTS/Dashboard/Goal/Session/profile remain owned by the user project"},
    "maintainer_surface": ["source repository and private execution memory","allowlist/provenance/license review","fresh-root export and residue scan","tree/diff/manifest validation","public repository update and release authorization"],
    "end_user_surface": ["clone current bm-sge-governance","install --target target-project","upgrade --target with backup/install record","doctor and recoverable uninstall","advanced --source only for explicit test or alternate-source diagnostics"],
    "identity": ["source_revision","manifest_revision","export_run_id","candidate_id","projection_commit","release_tag"],
    "workflow": ["freeze contract","build fresh staging","scan and compare exact tree","independent validation","human release decision","authorized public repo update","tag/release readback"],
    "contribution": ["public PR is input, not canonical truth","maintainer reviews and ports/merges into private source","rerun export and validation","only then update public projection","retain PR provenance"],
    "gates": ["Goal/Context/SGC/Conformance","Goal Contract and Goal Patch","license/provenance and default-deny","ERBE RED/GREEN","clean-room/UAT","independent Validation","Semantic Review","OPCM/closeout-language/post-closeout reconciliation"],
    "session_dag": ["S-016 -> S-017 -> S-018 -> S-019 -> S-020 -> S-021 -> S-022","S-022 is the only Goal closure session; any earlier Done closes only its bounded scope"],
    "scope_delta": "No approved Scope Delta at design landing. Any deletion, authority change, release widening or conversion of public projection into a second source requires a new Goal Patch and human approval.",
    "closeout": {"must_report":"slice verdict, Session/Goal terminal state, remaining must-haves, Scope Delta, next Session, human decision state","forbidden":"public repo created, published, production-ready or GitHub mutation completed based only on this design"},
    "minimum_safe_slice": "S-016 freezes the dual-repository contract, public content boundary, identity axes and negative cases before any implementation or remote action.",
    "implementation_ladder": ["reserved for SP-003-GP-001 resolution: S-016 contract -> S-017 maintainer projection -> S-018 lifecycle surface -> S-019 identity/release governance -> S-020 contribution flow -> S-021 clean-room/UAT/independent validation -> S-022 final closure"]
  },
  "claim_policy": {
    "claim_definitions": [
      {"claim_id":"ODA-DESIGN-LANDED","statement":"SP-003 design contract, Goal, Stage Plan and execution entries are durably recorded."},
      {"claim_id":"ODA-CANDIDATE-VALIDATED","statement":"A bounded implementation candidate has passed the declared clean-room and independent validation evidence."},
      {"claim_id":"ODA-COMPLETE","statement":"The full SP-003 completion rule is satisfied for the bounded public distribution architecture."},
      {"claim_id":"ODA-PUBLISHED","statement":"The bm-sge-governance GitHub repository has been externally updated and released."}
    ],
    "allowed_claim_ids":["ODA-DESIGN-LANDED","ODA-CANDIDATE-VALIDATED","ODA-COMPLETE"],
    "claim_statements":[
      {"claim_id":"ODA-DESIGN-LANDED","disposition":"allowed"},
      {"claim_id":"ODA-CANDIDATE-VALIDATED","disposition":"allowed"},
      {"claim_id":"ODA-COMPLETE","disposition":"allowed"},
      {"claim_id":"ODA-PUBLISHED","disposition":"forbidden"}
    ]
  },
  "completion_rule": {"completion_claim_id":"ODA-COMPLETE","required_status":"landed"},
  "approval_authorities":[{"authority_kind":"human","authority_id":"repo-owner"}],
  "approval_registry":[],
  "approved_scope_delta_registry":[]
}
